{
  "$schema": "https://json-schema.org/draft/2020-12/schema",
  "$id": "https://dogukanlive.com/schema/daily-report.schema.json",
  "title": "Günlük Kripto Raporu",
  "type": "object",
  "required": [
    "schemaVersion",
    "id",
    "language",
    "title",
    "publishedAt",
    "updatedAt",
    "status",
    "author",
    "market",
    "brief",
    "sections",
    "followUps",
    "sources",
    "assets",
    "disclaimer"
  ],
  "additionalProperties": false,
  "properties": {
    "schemaVersion": {
      "const": 1
    },
    "id": {
      "type": "string",
      "pattern": "^\\d{4}-\\d{2}-\\d{2}$"
    },
    "language": {
      "const": "tr"
    },
    "title": {
      "type": "string",
      "minLength": 5,
      "maxLength": 200
    },
    "publishedAt": {
      "type": "string",
      "minLength": 20
    },
    "updatedAt": {
      "type": "string",
      "minLength": 20
    },
    "status": {
      "enum": [
        "published",
        "draft"
      ]
    },
    "author": {
      "type": "object",
      "required": [
        "name",
        "url"
      ],
      "additionalProperties": false,
      "properties": {
        "name": {
          "type": "string",
          "minLength": 2
        },
        "url": {
          "type": "string",
          "pattern": "^https://"
        }
      }
    },
    "market": {
      "type": "object",
      "required": [
        "asOf",
        "coins",
        "fearGreed"
      ],
      "additionalProperties": false,
      "properties": {
        "asOf": {
          "type": "string",
          "minLength": 20
        },
        "coins": {
          "type": "object",
          "minProperties": 1,
          "additionalProperties": {
            "type": "object",
            "required": [
              "priceUsd",
              "change24h"
            ],
            "additionalProperties": false,
            "properties": {
              "priceUsd": {
                "type": [
                  "number",
                  "null"
                ]
              },
              "change24h": {
                "type": [
                  "number",
                  "null"
                ]
              }
            }
          }
        },
        "btcDominance": {
          "type": [
            "number",
            "null"
          ]
        },
        "ethDominance": {
          "type": [
            "number",
            "null"
          ]
        },
        "totalMarketCapUsd": {
          "type": [
            "number",
            "null"
          ]
        },
        "volume24hUsd": {
          "type": [
            "number",
            "null"
          ]
        },
        "dataSource": {
          "type": [
            "string",
            "null"
          ],
          "maxLength": 120
        },
        "fearGreed": {
          "type": "object",
          "required": [
            "value",
            "label"
          ],
          "additionalProperties": false,
          "properties": {
            "value": {
              "type": [
                "integer",
                "null"
              ]
            },
            "label": {
              "type": [
                "string",
                "null"
              ]
            },
            "previousValue": {
              "type": [
                "integer",
                "null"
              ]
            },
            "weekAgoValue": {
              "type": [
                "integer",
                "null"
              ]
            }
          }
        }
      }
    },
    "brief": {
      "type": "object",
      "required": [
        "mood",
        "why",
        "criticalEvents",
        "mainRisk"
      ],
      "additionalProperties": false,
      "properties": {
        "mood": {
          "enum": [
            "Temkinli",
            "İyimser",
            "Kararsız",
            "Riskli"
          ]
        },
        "why": {
          "type": "string",
          "minLength": 20,
          "maxLength": 400
        },
        "criticalEvents": {
          "type": "array",
          "maxItems": 4,
          "items": {
            "type": "object",
            "required": [
              "title"
            ],
            "additionalProperties": false,
            "properties": {
              "timeTr": {
                "type": [
                  "string",
                  "null"
                ],
                "pattern": "^([01]\\d|2[0-3]):[0-5]\\d$"
              },
              "title": {
                "type": "string",
                "minLength": 3,
                "maxLength": 60
              }
            }
          }
        },
        "mainRisk": {
          "type": "string",
          "minLength": 10,
          "maxLength": 300
        }
      }
    },
    "sections": {
      "type": "object",
      "required": [
        "yesterday",
        "agenda",
        "today",
        "turkey",
        "risks"
      ],
      "additionalProperties": false,
      "properties": {
        "yesterday": {
          "type": "array",
          "maxItems": 6,
          "items": {
            "type": "object",
            "required": [
              "item",
              "outcome"
            ],
            "additionalProperties": false,
            "properties": {
              "item": {
                "type": "string",
                "minLength": 3,
                "maxLength": 200
              },
              "outcome": {
                "type": "string",
                "minLength": 3,
                "maxLength": 400
              }
            }
          }
        },
        "agenda": {
          "type": "array",
          "minItems": 1,
          "maxItems": 5,
          "items": {
            "type": "object",
            "required": [
              "importance",
              "title",
              "summary",
              "source"
            ],
            "additionalProperties": false,
            "properties": {
              "importance": {
                "enum": [
                  "kritik",
                  "onemli",
                  "bilgi"
                ]
              },
              "title": {
                "type": "string",
                "minLength": 3,
                "maxLength": 160
              },
              "summary": {
                "type": "string",
                "minLength": 20,
                "maxLength": 600
              },
              "source": {
                "type": "object",
                "required": [
                  "url",
                  "title"
                ],
                "additionalProperties": false,
                "properties": {
                  "url": {
                    "type": "string",
                    "pattern": "^https://[^\\s]+$",
                    "maxLength": 500
                  },
                  "title": {
                    "type": "string",
                    "minLength": 2,
                    "maxLength": 200
                  },
                  "publisher": {
                    "type": [
                      "string",
                      "null"
                    ],
                    "maxLength": 120
                  }
                }
              }
            }
          }
        },
        "today": {
          "type": "array",
          "maxItems": 8,
          "items": {
            "type": "object",
            "required": [
              "title"
            ],
            "additionalProperties": false,
            "properties": {
              "timeTr": {
                "type": [
                  "string",
                  "null"
                ],
                "pattern": "^([01]\\d|2[0-3]):[0-5]\\d$"
              },
              "title": {
                "type": "string",
                "minLength": 3,
                "maxLength": 200
              }
            }
          }
        },
        "turkey": {
          "type": "object",
          "required": [
            "hasNews",
            "items"
          ],
          "additionalProperties": false,
          "properties": {
            "hasNews": {
              "type": "boolean"
            },
            "items": {
              "type": "array",
              "maxItems": 4,
              "items": {
                "type": "object",
                "required": [
                  "title",
                  "summary",
                  "source"
                ],
                "additionalProperties": false,
                "properties": {
                  "title": {
                    "type": "string",
                    "minLength": 3,
                    "maxLength": 160
                  },
                  "summary": {
                    "type": "string",
                    "minLength": 10,
                    "maxLength": 600
                  },
                  "source": {
                    "type": "object",
                    "required": [
                      "url",
                      "title"
                    ],
                    "additionalProperties": false,
                    "properties": {
                      "url": {
                        "type": "string",
                        "pattern": "^https://[^\\s]+$",
                        "maxLength": 500
                      },
                      "title": {
                        "type": "string",
                        "minLength": 2,
                        "maxLength": 200
                      },
                      "publisher": {
                        "type": [
                          "string",
                          "null"
                        ],
                        "maxLength": 120
                      }
                    }
                  }
                }
              }
            }
          }
        },
        "risks": {
          "type": "array",
          "maxItems": 3,
          "items": {
            "type": "string",
            "minLength": 10,
            "maxLength": 300
          }
        }
      }
    },
    "followUps": {
      "type": "array",
      "minItems": 1,
      "maxItems": 5,
      "items": {
        "type": "string",
        "minLength": 5,
        "maxLength": 200
      }
    },
    "sources": {
      "type": "array",
      "items": {
        "type": "object",
        "required": [
          "url",
          "title"
        ],
        "additionalProperties": false,
        "properties": {
          "url": {
            "type": "string",
            "pattern": "^https://[^\\s]+$",
            "maxLength": 500
          },
          "title": {
            "type": "string",
            "minLength": 2,
            "maxLength": 200
          },
          "publisher": {
            "type": [
              "string",
              "null"
            ],
            "maxLength": 120
          }
        }
      }
    },
    "assets": {
      "type": "object",
      "required": [
        "cardUrl",
        "audioUrl"
      ],
      "additionalProperties": false,
      "properties": {
        "cardUrl": {
          "type": [
            "string",
            "null"
          ]
        },
        "audioUrl": {
          "type": [
            "string",
            "null"
          ]
        }
      }
    },
    "disclaimer": {
      "type": "string",
      "minLength": 10
    }
  }
}
