{
  "schemaVersion": 1,
  "id": "2026-08-23",
  "language": "tr",
  "title": "23 Ağustos 2026, Pazar",
  "publishedAt": "2026-08-23T07:56:26+03:00",
  "updatedAt": "2026-08-23T07:56:26+03:00",
  "status": "published",
  "author": {
    "name": "Doğukan Doğan",
    "url": "https://dogukanlive.com/hakkimda"
  },
  "market": {
    "asOf": "2026-08-23T07:48:00+03:00",
    "coins": {
      "BTC": {
        "priceUsd": 76743,
        "change24h": -2.391160932329205
      },
      "ETH": {
        "priceUsd": 2397.01,
        "change24h": -5.012647261927938
      },
      "SOL": {
        "priceUsd": 92.74,
        "change24h": -7.758199350360667
      },
      "BNB": {
        "priceUsd": 685.28,
        "change24h": -5.325830816543331
      },
      "XRP": {
        "priceUsd": 1.46,
        "change24h": -11.926753483002708
      }
    },
    "btcDominance": 59.408550386688816,
    "ethDominance": 11.174164871804317,
    "totalMarketCapUsd": 2587153762137.097,
    "volume24hUsd": 114058161532.65611,
    "fearGreed": {
      "value": 66,
      "label": "Açgözlülük",
      "previousValue": 71,
      "weekAgoValue": 34
    }
  },
  "brief": {
    "mood": "Temkinli",
    "why": "Geçen haftaki güçlü rallinin (CLARITY Act iyimserliği, Hazine'nin tahvil geri alım genişletmesi ve güçlü ETF girişleri) ardından BTC cumartesi sabahı kısa süreliğine 79.500 dolara dayandı; ancak aşırı alım bölgesindeki yüksek kaldıraçlı long pozisyonlar zorunlu satışla tasfiye oldu ve bu dalga özellikle XRP olmak üzere altcoinlerde derinleşerek bugüne sarktı.",
    "criticalEvents": [
      {
        "timeTr": null,
        "title": "Aşırı kaldıraç tasfiyesi sonrası destek testi"
      },
      {
        "timeTr": "01:00",
        "title": "CME vadeli işlem haftalık açılışı"
      }
    ],
    "mainRisk": "Aşırı kaldıraçlı pozisyonların henüz tam temizlenmemiş olması yeni bir tasfiye dalgasını tetikleyebilir."
  },
  "sections": {
    "yesterday": [
      {
        "item": "BTC'nin hafta sonu boyunca 75.000 dolar üzerini koruyup koruyamayacağı",
        "outcome": "Korudu: BTC cumartesi sabahı kısa süreliğine 79.500 dolara yükseldi, ardından aşırı kaldıraçlı pozisyonların tasfiyesiyle geriledi ama 75.000 desteği kırılmadı."
      },
      {
        "item": "Clarity Act'in 15 Eylül prosedür oylaması için Senato'da yeni bir ilerleme sinyali gelip gelmediği",
        "outcome": "Iska: yeni bir sinyal gelmedi. Senato ağustos tatilinde, oylama takvimi 8 Ağustos'ta belirlenen 15 Eylül'de değişmeden duruyor; etik ve çıkar çatışması maddeleri üzerindeki anlaşmazlık sürüyor."
      },
      {
        "item": "XRP ve altcoin rallisinin Pazartesi ETF akışlarıyla teyit edilip edilmeyeceği",
        "outcome": "Henüz test edilemedi: Pazartesi ETF verileri gelmedi, üstelik ralli zaten tersine döndü; XRP son 24 saatte yaklaşık yüzde 12 geriledi."
      },
      {
        "item": "CFTC'nin 27 Ağustos yazılı görüş son tarihine dair yeni bir adım atılıp atılmadığı",
        "outcome": "Iska: yeni bir adım yok. CFTC, 20 Ağustos'taki ilk İnovasyon Danışma Kurulu toplantısının ardından 27 Ağustos yazılı görüş sürecini olduğu gibi sürdürüyor."
      }
    ],
    "agenda": [
      {
        "importance": "kritik",
        "title": "Kripto piyasasında altı dakikalık flaş çöküş",
        "summary": "22 Ağustos'ta BTC, ETH ve XRP eşzamanlı sert düştü; 24 saatte 281 binden fazla işlemci tasfiye oldu ve toplam piyasa değeri dakikalar içinde önemli ölçüde eridi, önceki haftanın aşırı iyimserliği hızla tersine döndü.",
        "source": {
          "url": "https://coinpedia.org/news/bitcoin-ethereum-and-xrp-crash-as-1-7b-got-liquidated-in-24-hours/",
          "title": "Bitcoin, Ethereum and XRP Crash as $1.7B Got Liquidated in 24 Hours",
          "publisher": "Coinpedia"
        }
      },
      {
        "importance": "onemli",
        "title": "BTC'nin 79.500 dolardan sert dönüşü",
        "summary": "Bitcoin cumartesi sabahı kısa süreliğine 79.500 dolara yükseldikten sonra aşırı alım bölgesindeki yüksek kaldıraçlı long pozisyonların zorunlu satışıyla 77.000 doların altına geriledi; bu dönüş altcoin satışını tetikleyen ilk kıvılcım oldu.",
        "source": {
          "url": "https://www.crowdfundinsider.com/2026/08/300082-bitcoin-price-pulls-back-to-77k-erasing-hundreds-of-millions-in-leveraged-btc-long-positions/",
          "title": "Bitcoin Price Pulls Back To $77K, Erasing Hundreds Of Millions In Leveraged BTC Long Positions",
          "publisher": "Crowdfund Insider"
        }
      }
    ],
    "today": [
      {
        "timeTr": null,
        "title": "BTC'de destek testi ve tasfiye sonrası toparlanma denemesi"
      },
      {
        "timeTr": null,
        "title": "Altcoin satışının yayılıp yayılmayacağının izlenmesi"
      },
      {
        "timeTr": "01:00",
        "title": "CME vadeli işlem piyasalarının haftalık açılışı"
      }
    ],
    "turkey": {
      "hasNews": false,
      "items": []
    },
    "risks": [
      "Aşırı kaldıraçlı pozisyonların yeniden birikmesi yeni bir tasfiye dalgasını tetikleyebilir.",
      "Clarity Act'in Eylül'de de tıkanması düzenleyici belirsizliği uzatabilir."
    ]
  },
  "followUps": [
    "BTC Pazartesi ABD seans açılışında 75.000-76.000 dolar bandını koruyabilecek mi",
    "XRP'deki yüzde 12'ye yakın günlük düşüşün Pazartesi ETF akış verileriyle teyit mi edileceği yoksa toparlanma mı geleceği",
    "Fear&Greed endeksinin bugünkü 66 seviyesinden Pazartesi Greed bölgesinde mi kalacağı yoksa Fear'a mı döneceği",
    "CME vadeli işlemlerinde hafta sonu açığı oluşup oluşmayacağı ve hangi yönde kapanacağı"
  ],
  "sources": [
    {
      "url": "https://coinpedia.org/news/bitcoin-ethereum-and-xrp-crash-as-1-7b-got-liquidated-in-24-hours/",
      "title": "Bitcoin, Ethereum and XRP Crash as $1.7B Got Liquidated in 24 Hours",
      "publisher": "Coinpedia"
    },
    {
      "url": "https://www.crowdfundinsider.com/2026/08/300082-bitcoin-price-pulls-back-to-77k-erasing-hundreds-of-millions-in-leveraged-btc-long-positions/",
      "title": "Bitcoin Price Pulls Back To $77K, Erasing Hundreds Of Millions In Leveraged BTC Long Positions",
      "publisher": "Crowdfund Insider"
    }
  ],
  "assets": {
    "cardUrl": null,
    "audioUrl": null
  },
  "disclaimer": "Bilgilendirme amaçlıdır, yatırım tavsiyesi değildir."
}
