{
  "schemaVersion": 1,
  "id": "2026-09-02",
  "language": "tr",
  "title": "2 Eylül 2026, Çarşamba",
  "publishedAt": "2026-09-02T08:46:39+03:00",
  "updatedAt": "2026-09-02T08:46:39+03:00",
  "status": "published",
  "author": {
    "name": "Doğukan Doğan",
    "url": "https://dogukanlive.com/hakkimda"
  },
  "market": {
    "asOf": "2026-09-02T08:42:14+03:00",
    "coins": {
      "BTC": {
        "priceUsd": 77657,
        "change24h": -1.7927180878139535
      },
      "ETH": {
        "priceUsd": 2419.58,
        "change24h": -2.392652757935453
      },
      "SOL": {
        "priceUsd": 100.16,
        "change24h": -3.7282183246732714
      },
      "BNB": {
        "priceUsd": 688.43,
        "change24h": -0.7068263915529027
      },
      "XRP": {
        "priceUsd": 1.35,
        "change24h": -2.886198071272009
      }
    },
    "btcDominance": 59.115403115259866,
    "ethDominance": 11.068977910928766,
    "totalMarketCapUsd": 2629994395979.8413,
    "volume24hUsd": 84302272903.08733,
    "fearGreed": {
      "value": 63,
      "label": "Açgözlülük",
      "previousValue": 69,
      "weekAgoValue": 65
    }
  },
  "brief": {
    "mood": "Temkinli",
    "why": "ABD'nin hafta sonu İran hedeflerine düzenlediği yeni vuruşlar Hürmüz Boğazı'ndan petrol akışının kesintiye uğraması korkusunu tazeledi, ham petrol üç ayın zirvesine sıçradı; bu da enflasyon endişelerini ve şahin Fed faiz beklentilerini güçlendirip küresel tahvil satışını derinleştirerek risk iştahını bozdu.",
    "criticalEvents": [
      {
        "timeTr": null,
        "title": "ABD-İran gerilimi, Hürmüz Boğazı"
      },
      {
        "timeTr": "15:15",
        "title": "ABD ADP istihdam verisi"
      },
      {
        "timeTr": "17:00",
        "title": "ABD fabrika siparişleri"
      }
    ],
    "mainRisk": "Hürmüz Boğazı'ndaki çatışmanın tırmanması petrolü ve enflasyon beklentilerini daha da yukarı taşıyıp risk varlıklarında satışı derinleştirebilir."
  },
  "sections": {
    "yesterday": [
      {
        "item": "Ağustos tarım dışı istihdam verisinin Eylül FOMC faiz beklentisine etkisi",
        "outcome": "Veri henüz açıklanmadı; resmi NFP raporu bu hafta Cuma (4 Eylül) bekleniyor. Bu arada JOLTS (Temmuz, 7,27 milyon, beklentinin hafif altında) ve ISM imalat PMI (Ağustos, %54,6, Temmuz'un altında ama hâlâ genişleme bölgesinde) karışık sinyal verdi."
      },
      {
        "item": "Fogo mainnet'in yeniden başlaması ve çalınan 400 milyon FOGO'nun akıbeti",
        "outcome": "Isabetsiz: mainnet hâlâ durduruluyor, resmi bir yeniden başlama takvimi paylaşılmadı, çalınan tokenlerin akıbeti belirsizliğini koruyor."
      },
      {
        "item": "Capital B'nin 270 BTC alımının resmi olarak tamamlanması",
        "outcome": "Kısmi: 21 milyon euroluk finansman ay sonunda kapandı ancak 270 BTC'lik fiili alımın gerçekleştiğine dair ayrı, doğrulanmış bir açıklama bulunamadı."
      },
      {
        "item": "ISM imalat PMI ve JOLTS verilerinin beklenti karşısındaki konumu",
        "outcome": "Karışık geldi: ISM imalat PMI Ağustos'ta %54,6'ya gerileyip Temmuz'un (%55,6) altında kaldı; JOLTS iş ilanları 7,27 milyonla piyasa beklentisi olan 7,31 milyonun hafif altında ama önceki aydan yüksek geldi."
      }
    ],
    "agenda": [
      {
        "importance": "kritik",
        "title": "ABD-İran çatışması petrolü fırlattı, risk iştahını bozdu",
        "summary": "ABD'nin İran hedeflerine yönelik yeni vuruşlarının ardından ham petrol yaklaşık üç ayın zirvesine sıçradı (WTI 91 dolara yaklaştı, Brent 95 dolara yakın); Hürmüz Boğazı'ndan geçişte kesinti endişesi borsalarda ve kriptoda satışı tetikledi.",
        "source": {
          "url": "https://www.bloomberg.com/news/articles/2026-09-01/latest-oil-market-news-and-analysis-for-sept-2",
          "title": "Oil Extends Gain as Fresh US-Iran Attacks Cloud Hormuz Reopening",
          "publisher": "Bloomberg"
        }
      },
      {
        "importance": "kritik",
        "title": "10 yıllık ABD tahvil faizi 2023'ten bu yana en yükseğe yakın",
        "summary": "ABD 10 yıllık tahvil getirisi yüzde 4,8'in üzerine çıkarak Ekim 2023'ten bu yana en yüksek seviyeye yaklaştı; artış petrol kaynaklı enflasyon endişeleri ve Fed'in faiz artırabileceği beklentisiyle besleniyor, bu da risk varlıklarını baskılıyor.",
        "source": {
          "url": "https://tradingeconomics.com/united-states/government-bond-yield",
          "title": "United States 10-Year Government Bond Yield",
          "publisher": "Trading Economics"
        }
      },
      {
        "importance": "onemli",
        "title": "Fogo mainnet dördüncü gününde hâlâ durdurulmuş durumda",
        "summary": "400 milyon FOGO'nun (yaklaşık 3 milyon dolar) çalınmasının ardından cumartesiden beri durdurulan mainnet için resmi bir yeniden başlama takvimi hâlâ açıklanmadı; sahte bir tazminat oylaması paylaşımı da yayılıp yalanlandı.",
        "source": {
          "url": "https://www.theblock.co/news/defi/2026-08-29-layer-1-blockchain-fogo-halts-mainnet-after-attacker-receives-400-million-fogo-tokens-10-of-circulating-supply-413064",
          "title": "Layer 1 blockchain Fogo halts mainnet after attacker receives 400 million FOGO tokens, 10% of circulating supply",
          "publisher": "The Block"
        }
      },
      {
        "importance": "onemli",
        "title": "Gizlilik coinleri Zcash ve Monero güçlü rallisini sürdürüyor",
        "summary": "Zcash'in piyasa değeri 14 milyar doları aşarken Monero da yükselişini sürdürdü; zincir üstü gözetim endişeleri ve düzenleyici baskı gizlilik odaklı varlıklara talebi artırıyor.",
        "source": {
          "url": "https://finance.yahoo.com/news/canton-leads-privacy-coin-rally-105925843.html",
          "title": "Canton Leads Privacy Coin Rally As Midnight, Zcash, Monero Tick Up",
          "publisher": "Yahoo Finance"
        }
      },
      {
        "importance": "bilgi",
        "title": "Capital B 270 BTC alımı için finansmanı kapattı",
        "summary": "Fransız bitcoin hazine şirketi Capital B, Adam Back ve TOBAM'ın da katıldığı 21 milyon euroluk özel yerleşimi ay sonunda kapattı; hedef 270 BTC alıp toplam rezervi 3.415 BTC'ye çıkarmak, ancak alımın fiilen gerçekleştiğine dair ayrı bir teyit yok.",
        "source": {
          "url": "https://www.kucoin.com/news/flash/capital-b-raises-21m-to-buy-270-btc-issues-warrants-that-could-dilute-shareholders",
          "title": "Capital B Raises €21M to Buy ~270 BTC, Issues Warrants That Could Dilute Shareholders",
          "publisher": "KuCoin"
        }
      }
    ],
    "today": [
      {
        "timeTr": "15:15",
        "title": "ABD ADP istihdam raporu (Ağustos)"
      },
      {
        "timeTr": "17:00",
        "title": "ABD fabrika siparişleri verisi (Temmuz)"
      },
      {
        "timeTr": null,
        "title": "ABD-İran gerilimi ve Hürmüz Boğazı'ndaki gelişmeler"
      },
      {
        "timeTr": null,
        "title": "Fogo mainnet'in yeniden başlatılıp başlatılmayacağı"
      }
    ],
    "turkey": {
      "hasNews": false,
      "items": []
    },
    "risks": [
      "Hürmüz Boğazı'nda yeni bir çatışma dalgası petrol ve enflasyon üzerinden risk varlıklarını baskılayabilir.",
      "Tahvil getirilerindeki yükseliş sürerse borçlanma maliyetleri artışı kripto dahil risk iştahını daha da zayıflatabilir."
    ]
  },
  "followUps": [
    "Cuma günkü Ağustos NFP verisi beklentiyi aştı mı, Eylül FOMC faiz kararına etkisi ne olacak",
    "Fogo mainnet ne zaman yeniden başlayacak, çalınan 400 milyon FOGO geri alınabilecek mi",
    "ABD-İran geriliminde yeni bir tırmanma yaşanacak mı, Hürmüz Boğazı'ndan geçiş kesintiye uğrayacak mı",
    "Capital B'nin 270 BTC alımı resmi olarak teyit edilecek mi"
  ],
  "sources": [
    {
      "url": "https://www.bloomberg.com/news/articles/2026-09-01/latest-oil-market-news-and-analysis-for-sept-2",
      "title": "Oil Extends Gain as Fresh US-Iran Attacks Cloud Hormuz Reopening",
      "publisher": "Bloomberg"
    },
    {
      "url": "https://tradingeconomics.com/united-states/government-bond-yield",
      "title": "United States 10-Year Government Bond Yield",
      "publisher": "Trading Economics"
    },
    {
      "url": "https://www.theblock.co/news/defi/2026-08-29-layer-1-blockchain-fogo-halts-mainnet-after-attacker-receives-400-million-fogo-tokens-10-of-circulating-supply-413064",
      "title": "Layer 1 blockchain Fogo halts mainnet after attacker receives 400 million FOGO tokens, 10% of circulating supply",
      "publisher": "The Block"
    },
    {
      "url": "https://finance.yahoo.com/news/canton-leads-privacy-coin-rally-105925843.html",
      "title": "Canton Leads Privacy Coin Rally As Midnight, Zcash, Monero Tick Up",
      "publisher": "Yahoo Finance"
    },
    {
      "url": "https://www.kucoin.com/news/flash/capital-b-raises-21m-to-buy-270-btc-issues-warrants-that-could-dilute-shareholders",
      "title": "Capital B Raises €21M to Buy ~270 BTC, Issues Warrants That Could Dilute Shareholders",
      "publisher": "KuCoin"
    }
  ],
  "assets": {
    "cardUrl": null,
    "audioUrl": null
  },
  "disclaimer": "Bilgilendirme amaçlıdır, yatırım tavsiyesi değildir."
}
