{
  "schemaVersion": 1,
  "id": "2026-09-09",
  "language": "tr",
  "title": "9 Eylül 2026, Çarşamba",
  "publishedAt": "2026-09-09T08:58:43+03:00",
  "updatedAt": "2026-09-09T08:58:43+03:00",
  "status": "published",
  "author": {
    "name": "Doğukan Doğan",
    "url": "https://dogukanlive.com/hakkimda"
  },
  "market": {
    "asOf": "2026-09-09T08:55:27+03:00",
    "coins": {
      "BTC": {
        "priceUsd": 78878,
        "change24h": 0.33829362115594663
      },
      "ETH": {
        "priceUsd": 2494.42,
        "change24h": 0.8209264577995328
      },
      "SOL": {
        "priceUsd": 103.92,
        "change24h": 0.8744546879008231
      },
      "BNB": {
        "priceUsd": 751.27,
        "change24h": 0.06590446402293561
      },
      "XRP": {
        "priceUsd": 1.43,
        "change24h": 2.6343625440378124
      }
    },
    "btcDominance": 58.43095742000452,
    "ethDominance": 11.215181366227702,
    "totalMarketCapUsd": 2702732784055.857,
    "volume24hUsd": 90955602267.05057,
    "fearGreed": {
      "value": 66,
      "label": "Açgözlülük",
      "previousValue": 69,
      "weekAgoValue": 63
    }
  },
  "brief": {
    "mood": "Temkinli",
    "why": "Belirgin tek sebep yok; İran-ABD çatışmasının sürmesi ve Fed'in 16 Eylül'de faiz artırma ihtimalinin yüzde 60'ı geçmesi fiyatları baskılarken, yatırımcılar yarınki ABD ÜFE verisi öncesi dar bir bantta temkinli işlem yapıyor.",
    "criticalEvents": [
      {
        "timeTr": null,
        "title": "İran-ABD çatışması / petrol fiyatları"
      },
      {
        "timeTr": null,
        "title": "Fed faiz artışı beklentisi yükseliyor"
      }
    ],
    "mainRisk": "Fed'in 16 Eylül toplantısında faiz artırma ihtimalinin güçlenmesi ve İran-ABD geriliminin tırmanması risk iştahını baskılayabilir."
  },
  "sections": {
    "yesterday": [
      {
        "item": "10 Eylül Perşembe ABD ÜFE verisi beklentiyi aştı mı",
        "outcome": "Henüz belli değil - ÜFE verisi 10 Eylül 08:30 ET (TSİ 15:30) açıklanacak, sonuç henüz açıklanmadı."
      },
      {
        "item": "BTC 82.000 dolar direncini kırabildi mi yoksa yeniden mi reddedildi",
        "outcome": "Iska - BTC 25 Ağustos'tan bu yana dördüncü kez 82.000 doların altında reddedildi, fiyat 79.000 dolar bandının altında seyrediyor."
      },
      {
        "item": "İran-Umman Hürmüz anlaşması resmen IMO'ya bildirildi mi",
        "outcome": "Henüz resmi bildirim yapılmadı - İran yetkilileri anlaşmanın son aşamada olduğunu ve günler içinde imzalanıp bildirileceğini açıkladı."
      },
      {
        "item": "HYPE 84 dolar üzerinde tutunmaya devam etti mi",
        "outcome": "Kısmen - borsalar arasında fiyat 83-88 dolar bandında dağınık seyretti, net bir kırılma yok."
      }
    ],
    "agenda": [
      {
        "importance": "kritik",
        "title": "Fed faiz artırma ihtimali yüzde 60'ı geçti",
        "summary": "Vadeli faiz piyasaları Fed'in 16 Eylül toplantısında çeyrek puanlık artış yapma ihtimalini yüzde 60'ın üzerine taşıdı, bu da risk iştahını baskılıyor.",
        "source": {
          "url": "https://www.fool.com/coverage/stock-market-today/2026/09/08/crypto-market-today-sept-8-bitcoin-slides-as-fed-hike-odds-pass-60/",
          "title": "Crypto Market Today, Sept. 8: Bitcoin Slides as Fed Hike Odds Pass 60%",
          "publisher": "The Motley Fool"
        }
      },
      {
        "importance": "kritik",
        "title": "İran-ABD çatışması petrolü 100 dolara yaklaştırdı",
        "summary": "ABD ile İran arasındaki çatışmanın sürmesi ve yeni saldırılar petrol fiyatlarını varil başına 100 dolara yaklaştırdı, bu da enflasyon endişesiyle kripto fiyatlarını baskıladı.",
        "source": {
          "url": "https://finance.yahoo.com/personal-finance/investing/article/bitcoin-and-ethereum-prices-today-tuesday-september-8-2026-crypto-prices-sliding-as-us-iran-fighting-continues-113441984.html",
          "title": "Bitcoin and ethereum prices today, Tuesday, September 8, 2026: Crypto prices sliding as U.S.-Iran fighting continues",
          "publisher": "Yahoo Finance"
        }
      },
      {
        "importance": "kritik",
        "title": "Senato CLARITY Yasası oylamasını 15 Eylül'e aldı",
        "summary": "ABD Senatosu, kripto piyasalarını düzenleyecek CLARITY Yasası için usul oylamasını 15 Eylül'de yapmaya karar verdi; 60 oy eşiği için Demokrat desteği belirsizliğini koruyor.",
        "source": {
          "url": "https://www.kucoin.com/news/flash/u-s-senate-sets-clarity-act-vote-for-september-15-2026",
          "title": "U.S. Senate Sets CLARITY Act Vote for September 15, 2026",
          "publisher": "KuCoin"
        }
      },
      {
        "importance": "onemli",
        "title": "Bitcoin ETF'leri yıllık zararını kapatmaya yaklaştı",
        "summary": "Son üç haftada 3,8 milyar dolarlık girişe rağmen ABD spot Bitcoin ETF'leri 2026 yılı toplamında hâlâ yaklaşık 1 milyar dolar net çıkış ile başa baş noktasına 1 milyar dolar uzakta.",
        "source": {
          "url": "https://www.coindesk.com/daybook-us/2026/09/08/bitcoin-etfs-are-still-usd1-billion-shy-of-breaking-even-in-2026",
          "title": "BTC ETFs are still $1 billion shy of breaking even in 2026",
          "publisher": "CoinDesk"
        }
      },
      {
        "importance": "bilgi",
        "title": "İran, Umman ile Hürmüz anlaşmasının günler içinde imzalanacağını söyledi",
        "summary": "İran yetkilileri, Hürmüz Boğazı'nda geçici güvenli deniz koridoru için Umman ile anlaşmanın son aşamada olduğunu ve günler içinde IMO'ya bildirileceğini açıkladı.",
        "source": {
          "url": "https://www.bloomberg.com/news/articles/2026-09-07/iran-says-strait-of-hormuz-deal-with-oman-just-days-away",
          "title": "Iran Says Strait of Hormuz Deal With Oman Just Days Away",
          "publisher": "Bloomberg"
        }
      }
    ],
    "today": [
      {
        "timeTr": null,
        "title": "İran-Umman Hürmüz müzakereleri, IMO bildirimi beklentisi"
      },
      {
        "timeTr": null,
        "title": "LAPTOP memecoin lansmanı (Base chain)"
      },
      {
        "timeTr": null,
        "title": "FOMC 16 Eylül öncesi faiz beklentisiyle pozisyonlanma"
      }
    ],
    "turkey": {
      "hasNews": false,
      "items": []
    },
    "risks": [
      "Fed'in faiz artırma ihtimalinin güçlenmesi risk iştahını azaltabilir.",
      "İran-ABD çatışmasının tırmanması petrol fiyatlarını ve enflasyon beklentilerini yukarı çekebilir."
    ]
  },
  "followUps": [
    "ABD ÜFE verisi (10 Eylül) beklentiyi aştı mı",
    "BTC 82.000 dolar direncini kırabildi mi",
    "İran-Umman Hürmüz anlaşması resmen IMO'ya bildirildi mi",
    "HYPE 84 dolar üzerinde tutunmaya devam etti mi"
  ],
  "sources": [
    {
      "url": "https://www.fool.com/coverage/stock-market-today/2026/09/08/crypto-market-today-sept-8-bitcoin-slides-as-fed-hike-odds-pass-60/",
      "title": "Crypto Market Today, Sept. 8: Bitcoin Slides as Fed Hike Odds Pass 60%",
      "publisher": "The Motley Fool"
    },
    {
      "url": "https://finance.yahoo.com/personal-finance/investing/article/bitcoin-and-ethereum-prices-today-tuesday-september-8-2026-crypto-prices-sliding-as-us-iran-fighting-continues-113441984.html",
      "title": "Bitcoin and ethereum prices today, Tuesday, September 8, 2026: Crypto prices sliding as U.S.-Iran fighting continues",
      "publisher": "Yahoo Finance"
    },
    {
      "url": "https://www.kucoin.com/news/flash/u-s-senate-sets-clarity-act-vote-for-september-15-2026",
      "title": "U.S. Senate Sets CLARITY Act Vote for September 15, 2026",
      "publisher": "KuCoin"
    },
    {
      "url": "https://www.coindesk.com/daybook-us/2026/09/08/bitcoin-etfs-are-still-usd1-billion-shy-of-breaking-even-in-2026",
      "title": "BTC ETFs are still $1 billion shy of breaking even in 2026",
      "publisher": "CoinDesk"
    },
    {
      "url": "https://www.bloomberg.com/news/articles/2026-09-07/iran-says-strait-of-hormuz-deal-with-oman-just-days-away",
      "title": "Iran Says Strait of Hormuz Deal With Oman Just Days Away",
      "publisher": "Bloomberg"
    }
  ],
  "assets": {
    "cardUrl": null,
    "audioUrl": null
  },
  "disclaimer": "Bilgilendirme amaçlıdır, yatırım tavsiyesi değildir."
}
