{
  "schemaVersion": 1,
  "id": "2026-10-02",
  "language": "tr",
  "title": "2 Ekim 2026, Cuma",
  "publishedAt": "2026-10-02T07:51:05+03:00",
  "updatedAt": "2026-10-02T07:51:05+03:00",
  "status": "published",
  "author": {
    "name": "Doğukan Doğan",
    "url": "https://dogukanlive.com/hakkimda"
  },
  "market": {
    "asOf": "2026-10-02T07:48:00+03:00",
    "coins": {
      "BTC": {
        "priceUsd": 86465,
        "change24h": 2.924575909076976
      },
      "ETH": {
        "priceUsd": 2738.08,
        "change24h": 1.1097118910863892
      },
      "SOL": {
        "priceUsd": 122.36,
        "change24h": 2.861719494388163
      },
      "BNB": {
        "priceUsd": 781.4,
        "change24h": 1.5674757334673854
      },
      "XRP": {
        "priceUsd": 1.52,
        "change24h": 1.2294282207667389
      }
    },
    "btcDominance": 58.84733107443337,
    "ethDominance": 11.321839781971065,
    "totalMarketCapUsd": 2951168710316.113,
    "volume24hUsd": 105397191052.22571,
    "dataSource": "CoinGecko + Alternative.me",
    "fearGreed": {
      "value": 72,
      "label": "Açgözlülük",
      "previousValue": 74,
      "weekAgoValue": 71
    }
  },
  "brief": {
    "mood": "İyimser",
    "why": "ABD'de çekirdek PCE enflasyonunun beklentinin altında gelmesi Ekim ayı faiz artırım ihtimalini düşürdü; buna haftalık 3.55 milyar dolarlık kripto fon girişi ve Citi'nin BTC hedefini yükseltmesi eklenince risk iştahı arttı.",
    "criticalEvents": [
      {
        "timeTr": "15:15",
        "title": "ABD ADP istihdam raporu"
      },
      {
        "timeTr": "15:30",
        "title": "ABD tarım dışı istihdam verisi"
      },
      {
        "timeTr": null,
        "title": "Bitget fiat ve P2P çekimlerini açıyor"
      }
    ],
    "mainRisk": "ABD 10 yıllık tahvil getirisinin yüksek seyretmesi, bugünkü istihdam verileri şahin gelirse BTC'nin kazançlarını geri verebilir."
  },
  "sections": {
    "yesterday": [
      {
        "item": "ISM imalat PMI beklentiyi aştı mı",
        "outcome": "Hayır, 54.5 ile 55 beklentisinin altında kaldı; buna karşın dokuzuncu ayı genişleme sürdü"
      },
      {
        "item": "Bitget'te net çıkışlar yavaşlıyor mu",
        "outcome": "Hayır, withdrawal'ların yeniden açılmasıyla 463 milyon dolarlık, son dört yılın en büyük günlük net çıkışı görüldü; bugün fiat ve P2P de açılıyor"
      },
      {
        "item": "Hyperliquid'in OTC yoluyla sattığı 3.75 milyon HYPE borsalara taşınıyor mu",
        "outcome": "Henüz değil; satış doğrudan kurumsal alıcıya yapıldı, tokenler açık piyasaya değil 7 Ekim'e kadar OTC kanalıyla transfer ediliyor"
      },
      {
        "item": "Osmosis allBTC teklifi resmi oylamaya geçti mi",
        "outcome": "Hayır, teklif şu an governance forumunda tartışma aşamasında, zincir üstü oylama henüz başlamadı"
      }
    ],
    "agenda": [
      {
        "importance": "kritik",
        "title": "Bitget tüm çekimleri tam açıyor",
        "summary": "Hack sonrası kademeli açılan Bitget'te fiat ve P2P çekimleri de bugün devreye giriyor; borsa son dört yılın en büyük günlük net çıkışını (463 milyon dolar) yaşamıştı.",
        "source": {
          "url": "https://www.tokenpost.com/news/business/24793",
          "title": "Bitget To Restore Withdrawals Across All Assets By Oct. 2",
          "publisher": "TokenPost"
        }
      },
      {
        "importance": "onemli",
        "title": "Citi BTC hedefini 113 bin dolara yükseltti",
        "summary": "Citigroup, 12 aylık Bitcoin hedefini 82 binden 113 bin dolara, Ethereum hedefini de 3.028 dolara çıkardı; gerekçe olarak ETF girişlerinin pozitife dönmesini gösterdi.",
        "source": {
          "url": "https://coingape.com/citi-raises-12-month-bitcoin-target-to-113k-ethereum-to-3028/",
          "title": "Citi Raises 12-Month Bitcoin Target to $113K, Ethereum to $3,028",
          "publisher": "CoinGape"
        }
      },
      {
        "importance": "onemli",
        "title": "Osmosis allBTC teminatını onarma teklifi",
        "summary": "Nomic köprüsündeki açıktan sonra allBTC'nin bitcoin desteğinde oluşan açığı kapatmak için topluluk havuzu ve dondurulan saldırgan varlıklarının kullanılması teklifi governance forumuna taşındı.",
        "source": {
          "url": "https://www.kucoin.com/news/flash/cosmos-dex-osmosis-proposes-using-community-pool-and-seized-btc-to-restore-allbtc-peg",
          "title": "Cosmos DEX Osmosis Proposes Using Community Pool and Seized BTC to Restore the allBTC Peg",
          "publisher": "KuCoin"
        }
      },
      {
        "importance": "bilgi",
        "title": "Hyperliquid ekip payını OTC ile sattı",
        "summary": "Hyperliquid Labs, ekibin aylık payı olan 3.75 milyon HYPE tokenini açık piyasaya sürmeden 329 milyon dolarlık anlaşmayla doğrudan kurumsal bir alıcıya sattı.",
        "source": {
          "url": "https://www.kucoin.com/news/flash/hyperliquid-unlocks-3-75m-hype-tokens-in-329m-otc-deal",
          "title": "Hyperliquid Unlocks 3.75M HYPE Tokens in $329M OTC Deal",
          "publisher": "KuCoin"
        }
      },
      {
        "importance": "onemli",
        "title": "ABD spot BTC ETF'lerinde giriş serisi bitti",
        "summary": "Dokuz gün süren ve 3 milyar dolara ulaşan giriş serisi, 149 milyon dolarlık çıkışla sona erdi; buna karşın haftalık toplam kripto fon girişi 3.55 milyar dolarla 2026'nın en güçlü haftası oldu.",
        "source": {
          "url": "https://www.theblock.co/news/markets/2026-10-01-bitcoin-etfs-9-day-3-billion-inflow-streak-comes-to-an-end-as-149-million-exits-the-funds-417384",
          "title": "Bitcoin ETFs' 9-day, $3 billion inflow streak comes to an end as $149 million exits the funds",
          "publisher": "The Block"
        }
      }
    ],
    "today": [
      {
        "timeTr": "15:15",
        "title": "ABD ADP istihdam raporu"
      },
      {
        "timeTr": "15:30",
        "title": "ABD tarım dışı istihdam verisi ve işsizlik oranı"
      },
      {
        "timeTr": null,
        "title": "Bitget fiat ve P2P çekimlerinin tam açılması"
      },
      {
        "timeTr": null,
        "title": "Osmosis governance forumunda allBTC teklifi tartışması"
      }
    ],
    "turkey": {
      "hasNews": false,
      "items": []
    },
    "risks": [
      "ABD 10 yıllık tahvil getirisinin yüksek seyretmesi risk iştahını sınırlıyor",
      "Bitget'teki hack sonrası güven kaybı ve çıkışlar borsa genelinde risk algısını bozabilir"
    ]
  },
  "followUps": [
    "ABD tarım dışı istihdam verisi beklentiyi aştı mı ve Fed'in Ekim toplantı ihtimalini nasıl değiştirdi",
    "Bitget'in net çıkışları fiat ve P2P açılışı sonrası yavaşladı mı",
    "Osmosis allBTC teklifi resmi zincir üstü oylamaya geçti mi",
    "Hyperliquid OTC alıcısı 3.75 milyon HYPE'ı borsalara taşıdı mı"
  ],
  "sources": [
    {
      "url": "https://www.tokenpost.com/news/business/24793",
      "title": "Bitget To Restore Withdrawals Across All Assets By Oct. 2",
      "publisher": "TokenPost"
    },
    {
      "url": "https://coingape.com/citi-raises-12-month-bitcoin-target-to-113k-ethereum-to-3028/",
      "title": "Citi Raises 12-Month Bitcoin Target to $113K, Ethereum to $3,028",
      "publisher": "CoinGape"
    },
    {
      "url": "https://www.kucoin.com/news/flash/cosmos-dex-osmosis-proposes-using-community-pool-and-seized-btc-to-restore-allbtc-peg",
      "title": "Cosmos DEX Osmosis Proposes Using Community Pool and Seized BTC to Restore the allBTC Peg",
      "publisher": "KuCoin"
    },
    {
      "url": "https://www.kucoin.com/news/flash/hyperliquid-unlocks-3-75m-hype-tokens-in-329m-otc-deal",
      "title": "Hyperliquid Unlocks 3.75M HYPE Tokens in $329M OTC Deal",
      "publisher": "KuCoin"
    },
    {
      "url": "https://www.theblock.co/news/markets/2026-10-01-bitcoin-etfs-9-day-3-billion-inflow-streak-comes-to-an-end-as-149-million-exits-the-funds-417384",
      "title": "Bitcoin ETFs' 9-day, $3 billion inflow streak comes to an end as $149 million exits the funds",
      "publisher": "The Block"
    }
  ],
  "assets": {
    "cardUrl": null,
    "audioUrl": null
  },
  "disclaimer": "Bilgilendirme amaçlıdır, yatırım tavsiyesi değildir."
}
